<?xml version="1.0" encoding="ISO-8859-1"?>
<resumenes xmlns:xsi="http://www.w3.org/2001/XMLSchema-instance" 
xsi:noNamespaceSchemaLocation="resumen.xsd">

  <ConjuntoSimples>
    <sinAtributo>manolo</sinAtributo>
    <sinAtributoTipoSimple>2003-09-11</sinAtributoTipoSimple>
    <sinAtributoTipoDefinido>Sevilla</sinAtributoTipoDefinido>
  </ConjuntoSimples>

<ConjuntoComplejos><!-- Como hay un all da igual el orden-->
  
  <Elemento2 id="0">
    <subElemento1></subElemento1>
    <subElemento2></subElemento2>
  </Elemento2>

<Elemento1>
    <subElemento1></subElemento1>
    <subElemento2></subElemento2>
  </Elemento1>

  <Elemento4 id="0">
    <subElemento1></subElemento1>
    <subElemento2>
      <localicad></localicad>
      <CP>41400</CP>
      <ciudad>Sevilla</ciudad>
    </subElemento2>
  </Elemento4>

  <Elemento3>
    <subElemento1></subElemento1>
    <subElemento2>
      <localicad></localicad>
      <CP>41400</CP>
      <ciudad>Sevilla</ciudad>
    </subElemento2>
  </Elemento3>

</ConjuntoComplejos>

<Secuencia>
  <telefono></telefono>
  <contrasena>Usuario1</contrasena>
  <mes>11</mes>
</Secuencia>



<pokemon>Rojo</pokemon>
<pokemon>Azul</pokemon>


</resumenes>